{
  "version": "1.1.0",
  "description": "Android Event Engine Sprint 1 Holdout Evaluation Set (20% Stratified)",
  "target_categories": [
    "finance.income",
    "finance.expense.food",
    "finance.expense.transport",
    "finance.expense.shopping",
    "finance.transfer",
    "music",
    "study.lesson",
    "study.deadline",
    "message",
    "advertisement",
    "authentication",
    "other"
  ],
  "samples": [
    {
      "id": "s1_fin_inc_0066",
      "package_name": "ru.alfabank.mobile.android",
      "source_type": "notification",
      "title": "Альфа-Банк",
      "text": "Пополнение карты через СБП: +3 823 ₽ из Банка ВТБ",
      "sub_text": null,
      "category": "finance.income",
      "intent": "sbp_incoming",
      "entities": {
        "channel": "СБП",
        "amount": 3823.0,
        "currency": "RUB"
      },
      "is_hard_case": false,
      "hard_case_reason": null,
      "expected_precision_critical": true
    },
    {
      "id": "s1_fin_inc_0043",
      "package_name": "ru.raiffeisennews",
      "source_type": "notification",
      "title": "Райффайзен",
      "text": "Входящий перевод +2 144 ₽ от Максим Р. по номеру счета",
      "sub_text": null,
      "category": "finance.income",
      "intent": "transfer_received",
      "entities": {
        "sender": "Максим Р.",
        "amount": 2144.0,
        "currency": "RUB"
      },
      "is_hard_case": false,
      "hard_case_reason": null,
      "expected_precision_critical": true
    },
    {
      "id": "s1_fin_inc_0016",
      "package_name": "com.idamob.tinkoff.android",
      "source_type": "notification",
      "title": "Т-Банк",
      "text": "Входящий перевод СБП +173 ₽ от Дмитрий К.. Сообщение: За кофе и обед",
      "sub_text": null,
      "category": "finance.income",
      "intent": "transfer_received",
      "entities": {
        "sender": "Дмитрий К.",
        "channel": "СБП",
        "amount": 173.0,
        "currency": "RUB"
      },
      "is_hard_case": false,
      "hard_case_reason": null,
      "expected_precision_critical": true
    },
    {
      "id": "fin_inc_010",
      "package_name": "com.ftc.faktura.multibank",
      "source_type": "notification",
      "title": "Агропромбанк",
      "text": "Зачисление перевода APB Online: +500.00 PRB от Смирнов А.В.",
      "sub_text": null,
      "category": "finance.income",
      "intent": "transfer_received",
      "entities": {
        "amount": 500.0,
        "currency": "PRB",
        "sender": "Смирнов А.В."
      },
      "is_hard_case": false,
      "hard_case_reason": null,
      "expected_precision_critical": true
    },
    {
      "id": "s1_fin_inc_0100",
      "package_name": "ru.sberbankmobile",
      "source_type": "notification",
      "title": "Сбер",
      "text": "Проценты по вкладу 'Лучший %': +1 405 ₽ зачислены на счет •• 4145",
      "sub_text": null,
      "category": "finance.income",
      "intent": "interest_credited",
      "entities": {
        "amount": 1405.0,
        "currency": "RUB"
      },
      "is_hard_case": false,
      "hard_case_reason": null,
      "expected_precision_critical": true
    },
    {
      "id": "s1_fin_inc_0059",
      "package_name": "com.idamob.tinkoff.android",
      "source_type": "notification",
      "title": "Т-Банк",
      "text": "Начислен кэшбэк +3 312 ₽ по программе лояльности. Доступно: 22 560 ₽",
      "sub_text": null,
      "category": "finance.income",
      "intent": "cashback_credited",
      "entities": {
        "amount": 3312.0,
        "currency": "RUB"
      },
      "is_hard_case": false,
      "hard_case_reason": null,
      "expected_precision_critical": true
    },
    {
      "id": "fin_inc_002",
      "package_name": "ru.sberbankmobile",
      "source_type": "notification",
      "title": "СберБанк",
      "text": "Возврат 1000",
      "sub_text": null,
      "category": "finance.income",
      "intent": "refund_received",
      "entities": {
        "amount": 1000.0,
        "currency": "RUB"
      },
      "is_hard_case": true,
      "hard_case_reason": "Минималистичное уведомление возврата (Hard Case: 'Возврат 1000')",
      "expected_precision_critical": true
    },
    {
      "id": "s1_fin_inc_0074",
      "package_name": "ru.sberbankmobile",
      "source_type": "notification",
      "title": "Сбер",
      "text": "Пополнение 4 407",
      "sub_text": null,
      "category": "finance.income",
      "intent": "account_topup",
      "entities": {
        "amount": 4407.0,
        "currency": "RUB"
      },
      "is_hard_case": true,
      "hard_case_reason": "Сверхкраткий текст пополнения счета (Hard Case: 'Сбер: Пополнение 1000')",
      "expected_precision_critical": true
    },
    {
      "id": "s1_fin_inc_0077",
      "package_name": "ru.alfabank.mobile.android",
      "source_type": "notification",
      "title": "Альфа-Банк",
      "text": "Возврат покупки 4 626 ₽ от магазина 'Яндекс Маркет'. Деньги поступили на счет",
      "sub_text": null,
      "category": "finance.income",
      "intent": "refund_received",
      "entities": {
        "merchant": "Яндекс Маркет",
        "amount": 4626.0,
        "currency": "RUB"
      },
      "is_hard_case": true,
      "hard_case_reason": "Возврат средств за отмену покупки, классифицируется в finance.income",
      "expected_precision_critical": true
    },
    {
      "id": "s1_fin_inc_0083",
      "package_name": "ru.raiffeisennews",
      "source_type": "notification",
      "title": "Райффайзен",
      "text": "Входящий перевод +164 ₽ от Максим Р. по номеру счета",
      "sub_text": null,
      "category": "finance.income",
      "intent": "transfer_received",
      "entities": {
        "sender": "Максим Р.",
        "amount": 164.0,
        "currency": "RUB"
      },
      "is_hard_case": false,
      "hard_case_reason": null,
      "expected_precision_critical": true
    },
    {
      "id": "s1_fin_inc_0081",
      "package_name": "com.ftc.faktura.multibank",
      "source_type": "notification",
      "title": "Агропромбанк",
      "text": "Пополнение счета на 4 918 PRB через кассу отделения №3",
      "sub_text": null,
      "category": "finance.income",
      "intent": "cash_deposit",
      "entities": {
        "amount": 4918.0,
        "currency": "PRB"
      },
      "is_hard_case": false,
      "hard_case_reason": null,
      "expected_precision_critical": true
    },
    {
      "id": "s1_fin_inc_0084",
      "package_name": "com.idamob.tinkoff.android",
      "source_type": "notification",
      "title": "Т-Банк",
      "text": "Выплата дивидендов по акциям Озон Технологии: +237 ₽ на брокерский счет",
      "sub_text": null,
      "category": "finance.income",
      "intent": "dividends_credited",
      "entities": {
        "amount": 237.0,
        "currency": "RUB"
      },
      "is_hard_case": false,
      "hard_case_reason": null,
      "expected_precision_critical": true
    },
    {
      "id": "fin_inc_011",
      "package_name": "ru.sberbankmobile",
      "source_type": "notification",
      "title": "Сбербанк",
      "text": "Авито Доставка: покупатель подтвердил получение. +4 300 ₽ переведены на карту *0912",
      "sub_text": null,
      "category": "finance.income",
      "intent": "marketplace_sale",
      "entities": {
        "amount": 4300.0,
        "currency": "RUB",
        "merchant": "Авито"
      },
      "is_hard_case": false,
      "hard_case_reason": null,
      "expected_precision_critical": true
    },
    {
      "id": "s1_fin_inc_0042",
      "package_name": "ru.sberbankmobile",
      "source_type": "notification",
      "title": "СберБанк",
      "text": "Авито Доставка: выплата за проданный товар +2 071 ₽ на карту •• 1999",
      "sub_text": null,
      "category": "finance.income",
      "intent": "marketplace_payout",
      "entities": {
        "merchant": "Авито",
        "amount": 2071.0,
        "currency": "RUB"
      },
      "is_hard_case": false,
      "hard_case_reason": null,
      "expected_precision_critical": true
    },
    {
      "id": "s1_fin_inc_0068",
      "package_name": "ru.sberbankmobile",
      "source_type": "notification",
      "title": "Сбер",
      "text": "Пополнение счета наличными в банкомате №259: +3 969 ₽",
      "sub_text": null,
      "category": "finance.income",
      "intent": "atm_deposit",
      "entities": {
        "amount": 3969.0,
        "currency": "RUB"
      },
      "is_hard_case": false,
      "hard_case_reason": null,
      "expected_precision_critical": true
    },
    {
      "id": "s1_fin_inc_0067",
      "package_name": "com.idamob.tinkoff.android",
      "source_type": "notification",
      "title": "Т-Банк",
      "text": "Возврат налога (вычет за обучение): +3 896 ₽ от Федерального казначейства",
      "sub_text": null,
      "category": "finance.income",
      "intent": "tax_refund",
      "entities": {
        "amount": 3896.0,
        "currency": "RUB"
      },
      "is_hard_case": false,
      "hard_case_reason": null,
      "expected_precision_critical": true
    },
    {
      "id": "s1_fin_inc_0053",
      "package_name": "ru.sberbankmobile",
      "source_type": "notification",
      "title": "Сбер",
      "text": "Возврат 2 874",
      "sub_text": null,
      "category": "finance.income",
      "intent": "refund_received",
      "entities": {
        "amount": 2874.0,
        "currency": "RUB"
      },
      "is_hard_case": true,
      "hard_case_reason": "Сверхкраткий текст возврата средств (Hard Case: 'Возврат 1000')",
      "expected_precision_critical": true
    },
    {
      "id": "s1_fin_inc_0057",
      "package_name": "ru.alfabank.mobile.android",
      "source_type": "notification",
      "title": "Альфа-Банк",
      "text": "Возврат покупки 3 166 ₽ от магазина 'Яндекс Маркет'. Деньги поступили на счет",
      "sub_text": null,
      "category": "finance.income",
      "intent": "refund_received",
      "entities": {
        "merchant": "Яндекс Маркет",
        "amount": 3166.0,